id_filme,nome_filme,ano_lanc_filme,ano_fim_filme,descricao_filme
343,Men in Black,1997,2000,Men in Black segue as facanhas dos agentes Kay e Jay; membros de uma organizacao ultrassecreta criada para monitorar e policiar atividades alienigenas na Terra. Os dois Homens de Preto se encontram no meio da trama mortal por um terrorista intergalactico que chegou a Terra para assassinar dois embaixadores de galaxias opostas. Para evitar que os mundos colidam; o MiB deve rastrear o terrorista e impedir a destruicao da Terra. E apenas mais um dia tipico para os homens de preto.
344,Toy Story 2,1999,2002,Andy vai para o Cowboy Camp; deixando seus brinquedos para seus proprios dispositivos. As coisas mudam rapidamente quando um obsessivo colecionador de brinquedos chamado Al McWhiggen; dono do Toy Barn de Al; sequestra Woody. Os brinquedos de Andy montam uma missao de resgate ousada; Buzz Lightyear encontra sua partida e Woody tem que decidir onde ele e seu coracao realmente pertencem.
345,Unstoppable,2010,2013,Um trem desgovernado; transportando substancias quimicas toxicas e letais; esta desmoronando em Stanton; na Pensilvania; e apenas dois homens podem para-lo: um engenheiro veterano e um jovem maestro. Milhares de vidas estao na balanca enquanto esses herois comuns tentam perseguir um milhao de toneladas de aco e impedir um desastre epico.
346,Rush Hour 2,2001,2004,E hora de ferias para Carter quando ele se encontra ao lado de Lee em Hong Kong; desejando mais emocao. Enquanto Carter quer festejar e conhecer as mulheres; Lee esta a procura de um lorde da gangue Triade que pode ser responsavel por matar dois homens na embaixada americana. As coisas ficam complicadas quando os dois se deparam com uma trama de falsificacao. Os meninos logo chegam ao pescoco em brigas de mao e situacoes de risco de vida. Uma viagem de volta aos EUA pode fornecer as respostas sobre o bombardeio; a falsificacao e a verdadeira fidelidade da sexy agente aduaneira Isabella.
347,What Lies Beneath,2000,2003,Quando Claire Spencer comeca a ouvir vozes fantasmagoricas e a ver imagens assustadoras; ela se pergunta se um espirito de outro mundo esta tentando contata-la. Todo o tempo; o marido tenta tranquiliza-la dizendo que tudo esta em sua cabeca. Mas; como Claire investiga; ela descobre que o homem que ela ama pode saber mais do que ele esta deixando transparecer.
348,Cloudy with a Chance of Meatballs,2009,2012,O inventor Flint Lockwood cria uma maquina que faz as nuvens choverem alimentos; permitindo que os cidadaos de Chewandswallow se alimentem. Mas quando a comida caindo atinge proporcoes gigantescas; Flint deve lutar para evitar o desastre. Ele pode recuperar o controle da maquina e acabar com o clima selvagem antes que a cidade seja destruida?
349,Ice Age: Dawn of the Dinosaurs,2009,2012,Os tempos estao mudando para Manny; o mamute temperamental; Sid; o preguicoso da boca do motor e Diego; o esperto tigre-de-dentes-de-sabre. A vida esquenta para nossos herois quando eles encontram alguns vizinhos novos e nada amigaveis ??- os poderosos dinossauros.
350,The Secret Life of Walter Mitty,2013,2016,Uma timida foto gerente de revista que vive a vida atraves de devaneios embarca em uma aventura da vida real; quando um negativo desaparece.
351,Charlie's Angels,2000,2003,Aspectos dessa serie de sucesso da decada de 1970 sao semelhantes ao programa original: Angels Dylan; Natalie e Alex ainda trabalham para Charlie e fazem interface com Bosley. Eles ainda balancam os cabelos; param o transito com um sorriso e um chute no traseiro. As diferencas sao o humor nada sutil; o treinamento em artes marciais e a premissa de alta tecnologia: desta vez; eles estao na trilha do software roubado.
352,The Departed,2006,2009,Para derrubar a mafia irlandesa de South Boston; a policia envia uma para infiltrar-se no submundo; sem perceber que o sindicato fez o mesmo. Enquanto um policial disfarcado agrada o chefao da mafia; um criminoso de carreira sobe nas fileiras da policia. Mas ambos os lados logo descobrem que ha uma toupeira entre eles.
353,Mulan,1998,2001,Uma garota desleixada se disfarca de jovem para poder lutar com o exercito imperial chines contra os invasores hunos. Com a ajuda do sabio e enlouquecido dragao Mushu; Mulan pode salvar seu pais - e conquistar o coracao do belo Capitao Li Shang.
354,Tropic Thunder,2008,2011,O livro de memorias do veterano do Vietna 'Four Leaf' Tayback; Tropic Thunder; esta sendo transformado em filme; mas o diretor Damien Cockburn nao pode controlar o elenco de prima donnas. Atrasado no cronograma e acima do orcamento; a Cockburn e ordenada por um executivo de estudio a fazer as filmagens de volta aos trilhos; ou arriscar seu cancelamento. A conselho de Tayback; Cockburn deixa os atores no meio da selva para filmar as cenas restantes; mas; sem o conhecimento dos atores e da producao; o grupo foi deixado no meio do Triangulo Dourado; lar de gangues produtoras de heroina.
355,The Girl with the Dragon Tattoo,2011,2014,Esta adaptacao em lingua inglesa do romance sueco de Stieg Larsson segue um jornalista desonrado; Mikael Blomkvist; enquanto investiga o desaparecimento de uma sobrinha de um patriarca cansado de 40 anos atras. Ele e auxiliado pela hacker furada; tatuada e punk chamada Lisbeth Salander. Enquanto trabalham juntos na investigacao; Blomkvist e Salander descobrem uma imensa corrupcao alem de qualquer coisa que tenham imaginado.
356,Die Hard: With a Vengeance,1995,1998,O detetive de Nova York John McClane esta de volta e chutando o cara mau no terceiro episodio desta serie repleta de acao; que o encontra em parceria com o civil Zeus Carver para evitar a perda de vidas inocentes. McClane pensou ter visto tudo; ate que um genio chamado Simon contrata McClane; seu novo parceiro - e sua amada cidade - em um jogo mortal que exige sua concentracao.
357,Sherlock Holmes,2009,2012,O excentrico detetive consultor Sherlock Holmes e o doutor John Watson lutam para derrubar um novo inimigo e desvendar uma trama mortal que poderia destruir a Inglaterra.
358,Ben-Hur,2016,2019,Um nobre falsamente acusado sobreviveu a anos de escravidao para se vingar de seu melhor amigo que o traiu.
359,Atlantis: The Lost Empire,2001,2004,A tripulacao de arqueologos e exploradores mais altamente qualificados do mundo e liderada pelo historiador Milo Thatch quando eles embarcam no incrivel Ulysses submarino de 300 metros de altura e se aprofundam nos misterios do mar.
360,Alvin and the Chipmunks: The Road Chip,2015,2018,Atraves de uma serie de mal-entendidos; Alvin; Simon e Theodore acreditam que Dave vai propor a sua nova namorada em Nova York - e despeja-los. Eles tem tres dias para chegar ate ele e parar a proposta.
361,Valkyrie,2008,2011,Ferido na Africa durante a Segunda Guerra Mundial; o coronel nazista Claus von Stauffenberg retorna a sua Alemanha natal e se junta a Resistencia em um ousado plano de criar um governo paralelo e assassinar Adolf Hitler. Quando os eventos se desenrolam para que ele se torne um jogador central; ele se ve encarregado de liderar o golpe e matar pessoalmente o Fuhrer.
362,You Don't Mess with the Zohan,2008,2011,Um soldado israelense de contraterrorismo com uma ambicao secretamente fabulosa de se tornar um cabeleireiro de Manhattan. O desejo de Zohan e tao profundo que ele fara qualquer coisa - incluindo fingir sua propria morte e ir frente a frente com um taxista arabe - para realizar seus sonhos.
363,Pixels,2015,2018,Especialistas em videogames sao recrutados pelos militares para combater os personagens dos videogames da decada de 1980 que atacaram Nova York.
364,A.I. Artificial Intelligence,2001,2004,Um menino robotico; o primeiro programado para amar; David e adotado como um caso de teste por um funcionario da Cybertronics e sua esposa. Embora ele gradualmente se torne seu filho; uma serie de circunstancias inesperadas tornam essa vida impossivel para Davi. Sem a aceitacao final por humanos ou maquinas; David embarca em uma jornada para descobrir onde ele realmente pertence; descobrindo um mundo no qual a linha entre robo e maquina e ao mesmo tempo vasta e profundamente magra.
365,The Haunted Mansion,2003,2006,O workaholic Jim Evers e sua esposa / parceira de negocios; Sara; recebem uma ligacao do dono de uma mansao; Edward Gracey quer vender sua casa. Uma vez que a familia Evers chega a mansao; um mordomo os leva para jantar com Gracey. Gracey da uma olhada em Sara e ele acha que ela e sua amante perdida.
366,Contact,1997,2000,Contact e um filme de ficcao cientifica sobre um encontro com a inteligencia alienigena. Baseado no romance de Carl Sagan; o filme estrelou Jodie Foster como a cientista escolhida; que deve tomar algumas decisoes dificeis entre suas crencas; a verdade e a realidade.
367,Hollow Man,2000,2003,Pesquisador arrogante; Sebastian Caine esta trabalhando em um projeto para tornar criaturas vivas invisiveis e ele esta tao confiante que encontrou a formula certa que ele testa em si mesmo e logo comeca a desaparecer. O unico problema e que ninguem pode determinar como torna-lo visivel novamente. A situacao de Caine acaba por enlouquece-lo; com resultados aterradores.
368,The Interpreter,2005,2008,Depois que Silvia Broome; interprete da sede das Nacoes Unidas; ouve planos de um assassinato; um agente do Servico Secreto Americano e enviado para investigar.
369,Percy Jackson: Sea of Monsters,2013,2016,Em sua busca para enfrentar o mal supremo; Percy e seus amigos lutam com enxames de criaturas miticas para encontrar o mitico Velocino de Ouro e impedir que um mal antigo se levante.
370,Lara Croft Tomb Raider: The Cradle of Life,2003,2006,Lara Croft se aventura em um templo subaquatico em busca da mitologica Caixa de Pandora; mas; depois de protege-la; e prontamente roubada pelo vilao lider de um sindicato do crime chines. Lara deve recuperar a caixa antes que o cerebro maligno do sindicato a use para construir uma arma de capacidades catastroficas.
371,Now You See Me 2,2016,2019,Um ano depois de ultrapassar o FBI e ganhar a adulacao do publico com seus espetaculares espetaculos; os Quatro Cavaleiros ressurgem apenas para encontrar-se face a face com um novo inimigo que os convoca a realizar seu mais perigoso assalto ainda.
372,The Saint,1997,2000,Ivan Tretiak; chefe da mafia russa que quer criar uma crise do petroleo em Moscou e tomar o poder; envia Simon Templar; grande criminoso internacional; a Inglaterra para obter uma formula secreta para a fusao a frio da cientista norte-americana Emma Russell. Os templarios se apaixonam por Emma e tentam enganar Tretiak e seus guerrilheiros; escondendo-se deles em Moscou
373,Spy Game,2001,2004,O espiao veterano Nathan Muir esta prestes a se aposentar da CIA quando descobre que seu ex-protegido e amigo proximo; Tom Bishop; e um prisioneiro politico condenado a morrer em Pequim. Embora sua amizade tenha sido marcada por sangue ruim e ressentimento; Muir concorda em assumir a missao mais perigosa de sua carreira e resgatar Bishop.
374,Mission to Mars,2000,2003,Quando o contato e perdido com a tripulacao da primeira expedicao a Marte; uma missao de resgate e lancada para descobrir seu destino.
375,Rio,2011,2014,Capturado por contrabandistas quando era apenas um filhote; uma arara chamada Blu nunca aprendeu a voar e vive uma vida feliz e domesticada em Minnesota com sua amiga humana; Linda. Blu e pensado para ser o ultimo de sua especie; mas quando chega a noticia de que Jewel; uma mulher solitaria; mora no Rio de Janeiro; Blu e Linda vao ao encontro dela. Contrabandistas de animais sequestram Blu e Jewel; mas os dois logo escapam e comecam uma aventura perigosa de volta a liberdade - e Linda.
376,Bicentennial Man,1999,2002,Richard Martin compra um presente; um novo robo NDR-114. O produto e chamado Andrew pelo mais novo dos filhos da familia. Bicentennial Man segue a vida e os tempos de Andrew; um robo comprado como um eletrodomestico programado para executar tarefas domesticas. Quando Andrew comeca a sentir emocoes e pensamentos criativos; a familia Martin logo descobre que eles nao tem um robo comum.
377,Volcano,1997,2000,Um terremoto quebra uma pacifica manha de Los Angeles e abre uma fissura profunda na terra; fazendo com que lava comece a borbulhar. Quando um vulcao comeca a se formar no La Brea Tar Pits; o diretor do servico de gerenciamento de emergencia da cidade; Mike Roark; trabalhando com a geologa Amy Barnes; deve usar todos os recursos da cidade para tentar impedir que o vulcao consuma Los Angeles.
378,The Devil's Own,1997,2000,Frankie McGuire; um dos assassinos mais mortais do IRA; atrai uma familia americana para o fogo cruzado do terrorismo. Mas quando ele e enviado para os EUA para comprar armas; Frankie e alojado com a familia de Tom O'Meara; um policial de Nova York que nao sabe nada sobre a verdadeira identidade de Frankie. Sua amizade surpreendente e as crescentes suspeitas de Tom forcam Frankie a escolher entre a promessa de paz ou uma vida inteira de assassinato.
379,K-19: The Widowmaker,2002,2005,Quando o primeiro submarino nuclear da Russia falhar em sua viagem inaugural; a tripulacao deve correr para salvar o navio e evitar um desastre nuclear.
380,Conan the Barbarian,1982,1985,Uma adaptacao cinematografica do classico heroi de espadas e feiticaria; Conan; o Barbaro. Uma horda de guerreiros furiosos massacra os pais do jovem Conan e escraviza a crianca durante anos em The Wheel of Pain. Como o unico sobrevivente do massacre da infancia; Conan e libertado da escravidao e ensinou as antigas artes da luta. Transformando-se em uma maquina de matar; Conan viaja para o deserto em busca de vinganca contra Thulsa Doom; o homem responsavel por matar sua familia. No deserto; Conan se ocupa dos ladroes Valeria e Subotai. O grupo se depara com o rei Osric; que quer que o trio de guerreiros ajude a resgatar sua filha que se juntou a Doom nas colinas.
381,Cinderella Man,2005,2008,A verdadeira historia do boxeador; Jim Braddock; que; nos anos 1920; apos sua aposentadoria; tem um retorno surpresa para tirar ele e sua familia de um estado socialmente pobre.
382,The Nutcracker: The Untold Story,2010,2013,Situado em Viena de 1920; este conto de uma menina; cujo padrinho lhe da uma boneca especial em uma vespera de Natal.
383,Seabiscuit,2003,2006,Verdadeira historia do pequeno cavalo de corrida da era da Depressao cujas vitorias levantaram nao apenas os espiritos da equipe por tras dela; mas tambem os de sua nacao.
384,Twister,1996,1999,O meteorologista de TV Bill Harding esta tentando fazer com que sua esposa cacadora de tornados; Jo; assine os papeis do divorcio para que ele possa se casar com sua namorada; Melissa. Mas a Mae Natureza; na forma de uma serie de tempestades intensas varrendo Oklahoma; tem outros planos. Logo; os tres se juntaram a equipe de cacadores de tempestades enquanto tentavam inserir um dispositivo de medicao revolucionario no coracao de varios tornados extremamente violentos.
385,Cast Away,2000,2003,Chuck; um dos principais gerentes internacionais da FedEx; e Kelly; Ph.D. estudante; estao apaixonados e indo em direcao ao casamento. Entao o aviao de Chuck para a Malasia se esgota no mar durante uma terrivel tempestade. Ele e o unico sobrevivente; e ele se lava em uma pequena ilha com nada alem de alguns destrocos e jetsam da carga da aeronave.
386,Happy Feet,2006,2009,No mundo dos Pinguins Imperadores; que encontram suas almas gemeas atraves da musica; nasce um pinguim que nao sabe cantar. Mas ele pode sapatear algo feroz!
387,The Bourne Supremacy,2004,2007,Quando uma operacao da CIA para comprar documentos russos classificados e explodida por um agente rival; que entao aparece na sonolenta vila a beira-mar onde Bourne e Marie moram. Os dois correm por suas vidas e Bourne; que prometeu retaliacao caso alguem de sua antiga tentativa de contato com a vida; seja forcado a mais uma vez assumir sua vida como um assassino treinado para sobreviver.
388,Air Force One,1997,2000,Os terroristas russos conspiram para sequestrar a aeronave com o presidente e sua familia a bordo. O comandante-em-chefe encontra-se diante de uma situacao dificil: ceder aos terroristas e sacrificar sua familia; ou arriscar tudo para defender seus principios - e a integridade da nacao.
389,Ocean's Eleven,2001,2004,Menos de 24 horas depois de sua liberdade condicional; o carismatico ladrao Danny Ocean ja esta lancando seu proximo plano: em uma noite; a equipe de especialistas escolhidos a dedo por Danny tentara roubar mais de US $ 150 milhoes de tres cassinos de Las Vegas. Mas; para ganhar o dinheiro; Danny arrisca suas chances de se reconciliar com a ex-mulher; Tess.
390,The Three Musketeers,2011,2014,O jovem de cabeca quente D'Artagnan; junto com tres ex-lendarios; mas agora com sorte; os mosqueteiros devem se unir e derrotar um belo agente duplo e seu patrao vilao de tomar o trono frances e engolfar a Europa na guerra.
391,Hotel Transylvania,2012,2015,Dracula; que opera um resort de luxo longe do mundo humano; entra em modo superprotetor quando um menino descobre o resort e se apaixona pela filha adolescente do conde.
392,Enchanted,2007,2010,A bela princesa Giselle e banida por uma rainha malefica de sua terra magica e musical animada e se encontra na realidade das ruas da moderna Manhattan. Chocada por este novo ambiente estranho que nao funciona em uma base feliz para sempre; Giselle esta agora a deriva em um mundo caotico que precisa de encantamento. Mas quando Giselle comeca a se apaixonar por uma advogada de divorcio encantadoramente defeituosa que veio em sua ajuda - mesmo que ela ja tenha prometido a um perfeito principe de fadas em casa - ela tem que se perguntar: sera que uma visao de romance pode sobreviver? mundo real?
393,Safe House,2012,2015,Um perigoso renegado da CIA ressurge depois de uma decada em fuga. Quando a casa segura em que ele esta preso e atacada por mercenarios; um agente novato foge com ele. Agora; os improvaveis ??aliados devem permanecer vivos por tempo suficiente para descobrir quem os quer mortos.
394,102 Dalmatians,2000,2003,Prepare-se para um bom tempo uivando como um novo sortimento de herois animais irresistiveis sao desencadeados nesta cauda grande familia! Em uma improvavel alianca; o ultrajante Waddlesworth ... um papagaio que pensa ser um rottweiler ... junta-se a Oddball ... um filhote de cachorro de Dalmation sem marcas; ansioso para ganhar seus lugares! Juntos; eles embarcam em uma busca repleta de risos para enganar a sempre mal-intencionada Cruella De Vil
395,Tower Heist,2011,2014,Um gerente de condominio de luxo leva uma equipe de funcionarios a buscar o retorno do trapaceiro de Wall Street que os defraudou. Com apenas alguns dias ate o bilionario escapar com o crime perfeito; a improvavel equipe de ladroes amadores pede a ajuda do pequeno criminoso Slide para roubar os US $ 20 milhoes que eles tem certeza que estao escondidos na cobertura.
396,The Holiday,2006,2009,Duas mulheres; uma (Cameron Diaz) dos Estados Unidos e uma (Kate Winslet) da Gra-Bretanha; trocam de casa na epoca do Natal depois de maus rompimentos com seus namorados. Cada mulher encontra romance com um homem local (Jude Law; Jack Black); mas percebe que o iminente retorno para casa pode acabar com o relacionamento.
397,Enemy of the State,1998,2001,Advogado de Hotshot Washington; Robert Dean se torna uma vitima de roubo de identidade de alta tecnologia quando um hacker coloca um video incriminador em seu bolso. Logo; um agente de Seguranca Nacional desonesto decide recuperar a fita - e destruir Dean.
398,It's Complicated,2009,2012,Dez anos apos o divorcio; Jane e Jake Adler se unem para a formatura de seu filho e inesperadamente acabam dormindo juntos. Mas Jake e casado e Jane esta embarcando em um novo romance com seu arquiteto. Agora; ela tem que resolver a sua vida apenas quando ela pensou que tinha tudo planejado.
399,Ocean's Thirteen,2007,2010,A equipe de criminosos de Danny Ocean esta de volta e compondo um plano mais pessoal do que nunca. Quando o cruel dono do cassino; Willy Bank; cruza Reuben Tishkoff; causando um ataque cardiaco; Danny Ocean promete que ele e sua equipe farao de tudo para derrubar Willy Bank e tudo o que ele tem. Mesmo que isso signifique pedir ajuda de um inimigo.
400,Open Season,2006,2009,Boog; um domesticado 900lb. O urso pardo encontra-se encalhado na floresta 3 dias antes da estacao aberta. Forcados a confiar em Elliot; um veado-mula que fala rapido; os dois formam uma amizade improvavel e devem rapidamente reunir outros animais da floresta se quiserem formar um exercito de trapos contra os cacadores.
401,Divergent,2014,2017,Em um mundo dividido em faccoes baseadas em tipos de personalidade; Tris descobre que ela foi classificada como Divergente e nao se encaixa. Quando ela descobre um plano para destruir Divergents; Tris e o misterioso Quatro devem descobrir o que torna Divergents perigoso antes que seja tarde.
402,Enemy at the Gates,2001,2004,Enemy at the Gates e um filme de guerra de Jean-Jacques Annaud de 2001 que se passa durante a batalha de Stalingard na Segunda Guerra Mundial entre os russos e os alemaes.
403,The Rundown,2003,2006,Quando Travis; o filho da boca de um criminoso; desaparece na Amazonia em busca de um artefato precioso; seu pai envia Beck; que se torna rival de Travis pelas afeicoes de Mariana; uma misteriosa mulher brasileira. Com sua disposicao de aco; Beck e um homem de poucas palavras - mas leva toda a disciplina que ele consegue para trabalhar com Travis para prender um tirano que esta atras do mesmo tesouro.
404,Last Action Hero,1993,1996,Danny e obcecado por Jack Slater; um personagem ficticio do filme. Quando um bilhete magico o transporta para a ultima aventura de Jack; Danny se ve em um mundo onde a magia e a realidade do cinema colidem. Agora cabe a Danny salvar a vida de seu heroi e novo amigo.
405,Memoirs of a Geisha,2005,2008,Um epico epico romantico ambientado no Japao nos anos que antecederam a Segunda Guerra Mundial; uma crianca japonesa pobre e arrancada de sua familia para trabalhar como empregada domestica em uma casa de gueixas.
406,The Fast and the Furious: Tokyo Drift,2006,2009,A fim de evitar uma sentenca de prisao; Sean Boswell dirige-se a Toquio para viver com seu pai militar. Em uma secao de aluguel baixo da cidade; Shaun e pego no mundo subterraneo de corridas de drift
407,Arthur Christmas,2011,2014,Cada Natal; Papai Noel e seu vasto exercito de elfos altamente treinados produzem presentes e os distribuem pelo mundo em uma unica noite. No entanto; quando uma das 600 milhoes de criancas para receber um presente do Papai Noel na vespera de Natal e perdida; e considerado aceitavel para todos; mas um - Arthur. Arthur Claus e o filho desajustado de Santa que executa uma missao de recruta nao autorizada para obter o ultimo presente metade do caminho ao redor do mundo antes do amanhecer na manha de Natal.
408,Meet Joe Black,1998,2001,Quando o grim reaper chega para recolher a alma do megamogul Bill Parrish; ele chega com uma proposta: Hospede-o para ferias entre os que vivem no comercio por mais alguns dias de existencia. Parrish concorda e; usando o pseudonimo de Joe Black; Death comeca a participar da agenda diaria de Parrish e se apaixona pela filha do homem. No entanto; quando o feriado de Black acaba; a vida de Parrish tambem.
409,Collateral Damage,2002,2005,O bombeiro Gordon Brewer esta mergulhado no mundo complexo e perigoso do terrorismo internacional depois que ele perde sua esposa e filho em um atentado creditado a Claudio The Wolf Perrini.
410,All That Jazz,1979,1982,O filme semi-autobiografico de Bob Fosse celebra o show business despojado de brilho ou ilusoes vertiginosas. Joe Gideon (Roy Scheider) esta no topo da pilha; um dos diretores e coreografos de maior sucesso no teatro musical. Mas ele pode sentir seu mundo desmoronando lentamente ao redor dele - sua obsessao pelo trabalho quase destruiu sua vida pessoal; e apenas seus frascos de comprimidos o mantem em atividade.
411,Mirror Mirror,2012,2015,Depois que ela gasta todo o seu dinheiro; uma rainha da feiticeira malvada planeja se casar com um principe bonito e rico. Ha apenas um problema - ele esta apaixonado por uma linda princesa; Branca de Neve. Agora; junto com sete anoes rebeldes; Branca de Neve lanca uma batalha epica de bem contra o mal ...
412,Scott Pilgrim vs. the World,2010,2013,Scott Pilgrim e uma adaptacao cinematografica da aclamada serie premiada de graphic novels de mesmo nome pelo cartunista canadense Bryan Lee O'Malley. Scott Pilgrim e uma dancarina canadense de 23 anos que se apaixona por uma garota de entrega americana; Ramona V. Flowers; e precisa derrotar seus sete ex-diabos para poder namorar com ela.
413,The Core,2003,2006,O geofisico Dr. Josh Keyes descobre que uma forca desconhecida fez com que o nucleo interno da Terra parasse de girar. Com o campo magnetico do planeta se deteriorando rapidamente; nossa atmosfera literalmente comeca a se desfazer nas costuras com consequencias catastroficas. Para resolver a crise; Keyes; juntamente com uma equipe dos cientistas mais talentosos do mundo; viaja para o centro da Terra. Sua missao: detonar um dispositivo que reative o nucleo.
414,Nutty Professor II: The Klumps,2000,2003,A hilaridade comeca quando o professor Sherman Klump encontra romance com sua colega especialista em DNA; Denise Gaines; e descobre uma formula brilhante que reverte o envelhecimento. Mas o alter ego fino e desagradavel de Sherman; Buddy Love; quer sair ... e um grande pedaco da acao. E quando Buddy se solta; as coisas ficam seriamente malucas.
415,Scooby-Doo,2002,2005,A turma da Mystery Inc. seguiu caminhos separados e ficou separada por dois anos; ate que cada um recebesse um convite para a Spooky Island. Nao sabendo que os outros tambem foram convidados; eles aparecem e descobrem um parque de diversoes que afeta jovens visitantes de maneiras muito estranhas.
