id_filme,nome_filme,ano_lanc_filme,ano_fim_filme,descricao_filme
1,Avatar,2009,2012,No seculo 22; um fuzileiro naval paraplegico e despachado para a lua Pandora em uma missao unica; mas fica dividido entre seguir ordens e proteger uma civilizacao alienigena.
2,Pirates of the Caribbean: At World's End,2007,2010,O capitao Barbossa; que ha muito se acredita estar morto; voltou a vida e esta indo para a periferia da Terra com Will Turner e Elizabeth Swann. Mas nada e exatamente como parece.
3,Spectre,2015,2018,Uma mensagem enigmatica do passado de Bond envia-o em uma trilha para descobrir uma organizacao sinistra. Enquanto M luta contra forcas politicas para manter o servico secreto vivo; Bond descobre as camadas de fraude para revelar a terrivel verdade por tras da SPECTRE.
4,The Dark Knight Rises,2012,2015,Apos a morte do Procurador Harvey Dent; Batman assume a responsabilidade pelos crimes de Dent para proteger a reputacao do advogado atrasado e e posteriormente perseguido pelo Departamento de Policia de Gotham City. Oito anos depois; Batman encontra a misteriosa Selina Kyle e o vilao Bane; um novo lider terrorista que supera o melhor de Gotham. O Cavaleiro das Trevas ressurge para proteger uma cidade que o marcou como um inimigo.
5,John Carter,2012,2015,John Carter e um ex-capitao militar cansado da guerra que e inexplicavelmente transportado para o planeta misterioso e exotico de Barsoom (Marte) e relutantemente se envolve em um conflito epico. E um mundo a beira do colapso; e Carter redescobre sua humanidade quando percebe que a sobrevivencia de Barsoom e seu povo esta em suas maos.
6,Spider-Man 3,2007,2010,O aparentemente invencivel Homem-Aranha enfrenta uma nova safra de vilao - incluindo o Sandman que muda de forma. Enquanto os superpoderes do Homem-Aranha sao alterados por um organismo alienigena; seu alter ego; Peter Parker; lida com o inimigo Eddie Brock e tambem fica preso em um triangulo amoroso.
7,Tangled,2010,2013,Quando o mais procurado e mais charmoso bandido Flynn Rider do reino se esconde em uma misteriosa torre; ele e feito refem por Rapunzel; uma linda e resoluta adolescente com dezoito metros de cabelo dourado e magico. A curiosa cacadora de Flynn; que esta procurando seu ingresso para fora da torre onde ela esta trancada ha anos; faz um acordo com o ladrao bonito e a improvavel dupla parte para uma aventura repleta de acao; completa com um cavalo super-policial; um camaleao super-protetor e uma gangue de bandidos de pubs.
8,Avengers: Age of Ultron,2015,2018,Quando Tony Stark tenta iniciar um programa inoperante de manutencao da paz; as coisas dao errado e os Herois Mais Poderosos da Terra sao submetidos ao teste final; pois o destino do planeta esta em risco. Como o vilao Ultron emerge; cabe aos Vingadores para impedi-lo de aprovar seus planos terriveis; e aliancas e acoes inesperadas logo abrem o caminho para uma aventura global unica e epica.
9,Harry Potter and the Half-Blood Prince,2009,2012,Enquanto Harry comeca seu sexto ano em Hogwarts; ele descobre um livro antigo marcado como Propriedade do Enigma do Principe e comeca a aprender mais sobre o passado sombrio de Lord Voldemort.
10,Batman v Superman: Dawn of Justice,2016,2019,Temendo que as acoes de um super-heroi divino nao tenham sido travadas; o formidavel e vigoroso vigilante de Gotham City enfrenta o salvador mais reverenciado de Metropolis; enquanto o mundo luta com o tipo de heroi que realmente precisa. E com Batman e Superman em guerra um com o outro; uma nova ameaca rapidamente surge; colocando a humanidade em maior perigo do que nunca.
11,Superman Returns,2006,2009,Superman retorna para descobrir que sua ausencia de 5 anos permitiu que Lex Luthor andasse livre; e que aqueles que ele era o mais proximo tambem se sentiram abandonados e seguiram em frente. Luthor trama sua vinganca final que poderia ver milhoes de mortos e mudar a face do planeta para sempre; assim como livrar-se do Homem de Aco.
12,Quantum of Solace,2008,2011,Quantum of Solace continua as aventuras de James Bond apos Casino Royale. Traido por Vesper; a mulher que ele amava; 007 luta contra o desejo de tornar sua ultima missao pessoal. Perseguindo sua determinacao de descobrir a verdade; Bond e M interrogam White; que revela que a organizacao que chantageou Vesper e muito mais complexa e perigosa do que se imaginava.
13,Pirates of the Caribbean: Dead Man's Chest,2006,2009,O capitao Jack Sparrow consegue sair de uma divida de sangue com o fantasmagorico Davey Jones; ele tambem tenta evitar a condenacao eterna.
14,The Lone Ranger,2013,2016,Os Texas Rangers perseguem uma gangue de foras-da-lei liderada por Butch Cavendish; mas a gangue embosca os Rangers; aparentemente matando todos eles. Um sobrevivente e encontrado; no entanto; por um indio americano chamado Tonto; que o nutre de volta a saude. O Ranger; vestindo uma mascara e montando um garanhao branco chamado Silver; se junta a Tonto para levar a gangue inescrupulosa e outros daquela turma a justica.
15,Man of Steel,2013,2016,Um jovem menino aprende que ele tem poderes extraordinarios e nao e desta terra. Quando jovem; ele viaja para descobrir de onde veio e para o que foi enviado para fazer. Mas o heroi nele deve emergir se quiser salvar o mundo da aniquilacao e se tornar o simbolo de esperanca para toda a humanidade.
16,The Chronicles of Narnia: Prince Caspian,2008,2011,Um ano depois de suas incriveis aventuras no Leao; a Feiticeira e o Guarda-Roupa; Peter; Edmund; Lucy e Susan Pevensie retornam a Narnia para ajudar um jovem principe cuja vida foi ameacada pelo malvado rei Miraz. Agora; com a ajuda de um elenco colorido de novos personagens; incluindo Trufflehunter; o texugo; e Nikabrik; o anao; o cla Pevensie embarca em uma incrivel missao para garantir que Narnia seja devolvida ao seu legitimo herdeiro.
17,The Avengers,2012,2015,Quando um inimigo inesperado emerge e ameaca a seguranca global; Nick Fury; diretor da agencia internacional de manutencao da paz conhecida como S.H.I.E.L.D.; precisa de uma equipe para afastar o mundo da beira do desastre. Abrangendo o mundo; um esforco de recrutamento ousado comeca!
18,Pirates of the Caribbean: On Stranger Tides,2011,2014,Capitao Jack Sparrow cruza caminhos com uma mulher de seu passado; e ele nao tem certeza se e amor - ou se ela e uma vigarista implacavel que o esta usando para encontrar a lendaria Fonte da Juventude. Quando ela o forca a bordo do Queen Anne's Revenge; o navio do formidavel pirata Barba Negra; Jack se encontra em uma inesperada aventura em que ele nao sabe mais quem temer: Barba Negra ou a mulher de seu passado.
19,Men in Black 3,2012,2015,Os agentes J (Will Smith) e K (Tommy Lee Jones) estao de volta ... no tempo. J viu algumas coisas inexplicaveis ??em seus 15 anos com os Homens de Preto; mas nada; nem mesmo alienigenas; o deixa perplexo tanto quanto seu parceiro torto e reticente. Mas quando a vida de K e o destino do planeta sao colocados em risco; o Agente J tera que viajar de volta no tempo para consertar as coisas. J descobre que ha segredos para o universo que K nunca disse a ele - segredos que se revelarao quando ele se unir ao jovem agente K (Josh Brolin) para salvar seu parceiro; a agencia e o futuro da humanidade.
20,The Hobbit: The Battle of the Five Armies,2014,2017,Imediatamente apos os eventos da Desolacao de Smaug; Bilbo e os anoes tentam defender a montanha de tesouros de Erebor de outros que a reivindicam: os homens do Laketown arruinado e os elfos da Floresta das Trevas. Enquanto isso; um exercito de orcs liderados por Azog; o Destruidor; esta marchando sobre Erebor; alimentado pela ascensao do Lorde das Trevas; Sauron. Anoes; elfos e homens devem se unir; e a esperanca pela Terra-Media cai nas maos de Bilbo.
21,The Amazing Spider-Man,2012,2015,Peter Parker e um ex-aluno abandonado por seus pais quando menino; deixando-o para ser criado por seu tio Ben e tia May. Como a maioria dos adolescentes; Peter esta tentando descobrir quem ele e e como ele chegou a ser a pessoa que ele e hoje. Enquanto Peter descobre uma misteriosa pasta que pertenceu a seu pai; ele comeca uma busca para entender o desaparecimento de seus pais - levando-o diretamente para a Oscorp e o laboratorio do Dr. Curt Connors; ex-parceiro de seu pai. Enquanto o Homem-Aranha e colocado em rota de colisao com o alter ego de Connors; O Lagarto; Peter fara escolhas que alteram a vida para usar seus poderes e moldar seu destino para se tornar um heroi.
22,Robin Hood,2010,2013,Quando o soldado Robin se depara com o moribundo Robert de Loxley; ele promete devolver a espada do homem para sua familia em Nottingham. La; ele assume a identidade de Robert; romances sua viuva; Marion; e atrai a ira do xerife da cidade e do capanga do rei John; Godfrey.
23,The Hobbit: The Desolation of Smaug,2013,2016,Os Anoes; Bilbo e Gandalf escaparam com sucesso das Montanhas Sombrias e Bilbo ganhou o Um Anel. Todos eles continuam sua jornada para recuperar seu ouro do Dragao; Smaug.
24,The Golden Compass,2007,2010,Depois de escutar um segredo chocante; Lyra Belacqua; orfa precoce; troca sua existencia despreocupada; perambulando pelos corredores do Jordan College por uma aventura sobrenatural no extremo norte; sem saber que e parte de seu destino.
25,King Kong,2005,2008,Em 1933; Nova York; um produtor de cinema excessivamente ambicioso; coagiu seu elenco e contratou a tripulacao do navio para viajar ate a misteriosa Skull Island; onde eles encontraram Kong; um macaco gigante que e imediatamente ferido com a protagonista.
26,Titanic,1997,2000,84 anos depois; uma mulher de 101 anos chamada Rose DeWitt Bukater conta a historia a sua neta Lizzy Calvert; Brock Lovett; Lewis Bodine; Bobby Buell e Anatoly Mikailavich no Keldysh sobre sua vida em 10 de abril de 1912; em um navio chamado Titanic quando a jovem Rose embarca no navio de partida com os passageiros da classe alta e sua mae; Ruth DeWitt Bukater; e seu noivo; Caledon Hockley. Enquanto isso; um vagabundo e artista chamado Jack Dawson e seu melhor amigo Fabrizio De Rossi ganham ingressos de terceira classe para o navio em um jogo. E ela explica toda a historia desde a partida ate a morte do Titanic em sua primeira e ultima viagem em 15 de abril de 1912 as 2:20 da manha.
27,Captain America: Civil War,2016,2019,Apos os eventos de Age of Ultron; os governos coletivos do mundo aprovam um ato destinado a regular toda atividade sobre-humana. Isso polariza a opiniao entre os Vingadores; fazendo com que duas faccoes se alinhem com o Homem de Ferro ou o Capitao America; o que causa uma batalha epica entre os ex-aliados.
28,Battleship,2012,2015,Quando a humanidade transmite um sinal de radio para o espaco; uma resposta vem do ?Planeta G?; na forma de varios oficios alienigenas que caem nas aguas do Havai. O tenente Alex Hopper e um oficial de armas designado para o USS John Paul Jones; parte de uma coalizao naval internacional que se torna a ultima esperanca mundial de sobrevivencia
29,Jurassic World,2015,2018,Vinte e dois anos apos os eventos de Jurassic Park; Isla Nublar agora possui um parque tematico em dinossauro em pleno funcionamento; Jurassic World; como originalmente imaginado por John Hammond.
30,Skyfall,2012,2015,Quando a ultima tarefa de Bond se torna gravemente errada e agentes em todo o mundo sao expostos; o MI6 e atacado forcando M a realocar a agencia. Esses eventos fazem com que sua autoridade e posicao sejam contestadas por Gareth Mallory; o novo presidente do Comite de Inteligencia e Seguranca. Com o MI6 agora comprometido de dentro e de fora; M fica com um aliado em quem pode confiar: Bond. 007 leva para as sombras - ajudado apenas pelo agente de campo; Eve - seguindo uma trilha para a misteriosa Silva; cujos motivos letais e ocultos ainda nao se revelaram.
31,Spider-Man 2,2004,2007,Peter Parker esta passando por uma grande crise de identidade. Queimado de ser o Homem-Aranha; ele decide engavetar seu alter ego de super-herois; o que deixa a cidade sofrendo na esteira da carnificina deixada pelo malvado Doc Ock. Enquanto isso; Parker ainda nao consegue demonstrar seus sentimentos por Mary Jane Watson; uma garota que ele ama desde a infancia.
32,Iron Man 3,2013,2016,Quando o mundo de Tony Stark e dilacerado por um formidavel terrorista chamado Mandarim; ele comeca uma odisseia de reconstrucao e retribuicao.
33,Alice in Wonderland,2010,2013,Alice; uma despretensiosa e individual de 19 anos de idade; e prometida a um burro de um nobre ingles. Em sua festa de noivado; ela escapa da multidao para considerar se vai continuar com o casamento e cai em um buraco no jardim depois de avistar um coelho incomum. Chegando em um lugar estranho e surreal chamado 'Underland'; ela se encontra em um mundo que se assemelha aos pesadelos que ela teve quando crianca; cheios de animais falantes; rainhas e cavaleiros viloes e freneticos bandersnatches. Alice percebe que ela esta la por uma razao - para conquistar o horrivel Jabberwocky e restaurar a rainha de direito ao seu trono.
34,X-Men: The Last Stand,2006,2009,Quando uma cura e encontrada para tratar mutacoes; linhas sao tracadas entre os X-Men e The Brotherhood; um bando de poderosos mutantes organizados sob o antigo aliado de Xavier; Magneto.
35,Monsters University,2013,2016,Um olhar sobre a relacao entre Mike e Sulley durante seus dias na Universidade Monstros - quando eles nao eram necessariamente os melhores amigos.
36,Transformers: Revenge of the Fallen,2009,2012,Sam Witwicky deixa os Autobots para tras por uma vida normal. Mas quando sua mente esta cheia de simbolos enigmaticos; os Decepticons o atacam e ele e arrastado de volta para a guerra dos Transformers.
37,Transformers: Age of Extinction,2014,2017,A medida que a humanidade retoma as pecas; apos a conclusao de Transformers: Dark of the Moon; os Autobots e Decepticons praticamente desapareceram da face do planeta. Entretanto; um grupo de poderosos e engenhosos empresarios e cientistas tentam aprender com incursoes passadas de Transformadores e empurram os limites da tecnologia alem do que podem controlar - tudo isso enquanto uma antiga e poderosa ameaca Transformadora coloca a Terra em suas mentes.
38,Oz: The Great and Powerful,2013,2016,Oscar Diggs; um pequeno ilusionista de circo e con-artista; e levado do Kansas para a Terra de Oz; onde os habitantes assumem que ele e o grande mago da profecia; para salvar Oz das garras do mal.
39,The Amazing Spider-Man 2,2014,2017,Para Peter Parker; a vida esta ocupada. Entre tirar os bandidos como Homem-Aranha e passar tempo com a pessoa que ele ama; Gwen Stacy; a formatura do ensino medio nao pode ser rapida o suficiente. Peter nao esqueceu a promessa que fez ao pai de Gwen de protege-la; mas essa e uma promessa que ele nao pode cumprir. As coisas vao mudar para Peter quando um novo vilao; Electro; surgir; um velho amigo; Harry Osborn; retornar; e Peter descobrir novas pistas sobre seu passado.
40,TRON: Legacy,2010,2013,Sam Flynn; o filho de Kevin Flynn; experiente em tecnologia e audaz; investiga o desaparecimento de seu pai e e levado para o The Grid. Com a ajuda de um misterioso programa chamado Quorra; Sam procura impedir que o malvado ditador Clu entre no mundo real.
41,Cars 2,2011,2014,O carro de corrida Star Lightning McQueen e seu amigo Mater viajam para o exterior para competir na corrida do World Grand Prix. Mas o caminho para o campeonato se torna rochoso; ja que Mater se envolve em uma aventura intrigante: a espionagem internacional.
42,Green Lantern,2011,2014,Durante seculos; uma pequena mas poderosa forca de guerreiros; chamada de Tropa dos Lanternas Verdes; jurou manter a ordem intergalactica. Cada Lanterna Verde usa um anel que lhe da superpoderes. Mas quando um novo inimigo chamado Parallax ameaca destruir o equilibrio de poder no Universo; seu destino e o destino da Terra estao nas maos do primeiro humano recrutado.
43,Toy Story 3,2010,2013,Woody; Buzz e o resto dos brinquedos de Andy nao sao usados ??ha anos. Com Andy prestes a ir para a faculdade; a turma se ve acidentalmente deixada em uma creche nefasta. Os brinquedos devem se unir para fugir e voltar para casa para Andy.
44,Terminator Salvation,2009,2012,Todo crescido em 2018; pos-apocaliptico; John Connor deve liderar a resistencia dos humanos contra os robos militaristas cada vez mais dominantes. Mas quando Marcus Wright aparece; sua existencia confunde a missao enquanto Connor tenta determinar se Wright veio do futuro ou do passado - e se ele e amigo ou inimigo.
45,Furious 7,2015,2018,Deckard Shaw busca vinganca contra Dominic Toretto e sua familia por seu irmao comatoso.
46,World War Z,2013,2016,A vida do ex-investigador das Nacoes Unidas Gerry Lane e sua familia parece contente. De repente; o mundo e atormentado por uma misteriosa infeccao; transformando populacoes humanas inteiras em zumbis irracionais e sem mente. Depois de escapar do caos; Lane e persuadida a ir em uma missao para investigar esta doenca. O que se segue e uma jornada perigosa ao redor do mundo onde Lane deve enfrentar perigos terriveis e grandes dificuldades para encontrar respostas antes que a civilizacao humana caia.
47,X-Men: Days of Future Past,2014,2017,O conjunto dos X-Men derrota uma guerra pela sobrevivencia da especie ao longo de dois periodos de tempo; ao unir forcas com seus eus mais jovens em uma batalha epica que deve mudar o passado - para salvar nosso futuro.
48,Star Trek Into Darkness,2013,2016,Quando a tripulacao da Enterprise e chamada de volta para casa; eles descobrem que uma forca de terror incontrolavel dentro de sua propria organizacao detonou a frota e tudo o que ela representa; deixando nosso mundo em estado de crise. Com uma pontuacao pessoal para resolver; o Capitao Kirk lidera uma cacada a um mundo da zona de guerra para capturar uma arma de destruicao em massa de um homem. Enquanto nossos herois sao impelidos para um epico jogo de xadrez de vida e morte; o amor sera desafiado; as amizades serao dilaceradas e os sacrificios devem ser feitos para a unica familia que Kirk deixou: sua tripulacao.
49,Jack the Giant Slayer,2013,2016,A historia de uma antiga guerra que e reacendida quando um jovem fazendeiro involuntariamente abre um portal entre o nosso mundo e uma gigantesca raca de gigantes. Soltos na Terra pela primeira vez em seculos; os gigantes se esforcam para recuperar a terra que perderam; forcando o jovem Jack a entrar na batalha de sua vida para dete-los. Lutando por um reino; seu povo e o amor de uma corajosa princesa; ele se depara com os guerreiros irrefreaveis ??que ele achava que so existiam na lenda - e tem a chance de se tornar uma lenda.
50,The Great Gatsby,2013,2016,Uma adaptacao do romance de Long Island; de F. Scott Fitzgerald; onde Nick Carraway; do Midwesterner; e atraido para o mundo luxuoso de seu vizinho; Jay Gatsby. Porem; em breve; Carraway vera as rachaduras da existencia nouveau riche de Gatsby; onde a obsessao; a loucura e a tragedia o aguardam.
51,Prince of Persia: The Sands of Time,2010,2013,Um principe trapaceiro une-se relutantemente a uma misteriosa princesa e; juntos; correm contra as forcas das trevas para salvaguardar uma antiga adaga capaz de liberar as Areias do Tempo - presente dos deuses que pode reverter o tempo e permitir que seu possuidor governe o mundo.
52,Pacific Rim,2013,2016,Quando legioes de criaturas monstruosas; conhecidas como Kaiju; comecaram a se levantar do mar; comecou uma guerra que levaria milhoes de vidas e consumiria recursos da humanidade por anos a fio. Para combater o gigante Kaiju; um tipo especial de arma foi inventado: robos macicos; chamados Jaegers; que sao controlados simultaneamente por dois pilotos cujas mentes estao trancadas em uma ponte neural. Mas ate mesmo os Jaegers estao se mostrando quase indefesos diante do implacavel Kaiju. A beira da derrota; as forcas que defendem a humanidade nao tem escolha a nao ser se voltarem para dois herois improvaveis ??- um ex-piloto frustrado (Charlie Hunnam) e um estagiario nao testado (Rinko Kikuchi) - que se uniram para dirigir um lendario mas aparentemente obsoleto. Jaeger do passado. Juntos; eles permanecem como a ultima esperanca da humanidade contra o crescente apocalipse.
53,Transformers: Dark of the Moon,2011,2014,Sam Witwicky da seus primeiros passos na vida adulta; permanecendo um aliado humano relutante do lider da Autobot; Optimus Prime. O filme gira em torno da corrida espacial entre a URSS e os EUA; sugerindo que havia um papel Transformers oculto em tudo o que continua sendo um dos segredos mais perigosos do planeta.
54,Indiana Jones and the Kingdom of the Crystal Skull,2008,2011,Durante a Guerra Fria; os sovieticos - liderados por Irina Spalko; que empunha a espada - estao em busca de um cranio de cristal que tem poderes sobrenaturais relacionados a uma mistica Cidade Perdida de Ouro. Depois de ser capturado e depois escapar deles; Indy e coagido a ir ao Peru a mando de um jovem cujo amigo - e colega de Indy - o professor Oxley foi capturado por seu conhecimento do paradeiro do cranio.
55,The Good Dinosaur,2015,2018,Uma jornada epica no mundo dos dinossauros; onde um Apatosaurus chamado Arlo faz um improvavel amigo humano.
56,Brave,2012,2015,Brave e ambientado nas misticas Terras Altas da Escocia; onde Merida e a princesa de um reino governado pelo Rei Fergus e pela Rainha Elinor. Uma filha rebelde e um arqueiro realizado; Merida um dia desafia um costume sagrado da terra e; inadvertidamente; traz turbulencias ao reino. Em uma tentativa de consertar as coisas; Merida procura uma excentrica velha sabia e recebe um desejo malfadado. Tambem figurando na busca de Merida - e servindo como alivio comico - estao os tres senhores do reino: o enorme Lorde MacGuffin; o ranzinza Lorde Macintosh e o desagradavel Lorde Dingwall.
57,Star Trek Beyond,2016,2019,A equipe do USS Enterprise explora os limites mais distantes do espaco desconhecido; onde eles encontram um misterioso novo inimigo que os coloca e tudo o que a Federacao representa para o teste.
58,WALLAE,2008,2011,WALL  E e o ultimo robo deixado em uma Terra que foi invadida pelo lixo e todos os humanos fugiram para o espaco sideral. Por 700 anos ele continuou a tentar limpar a bagunca; mas desenvolveu algumas qualidades humanas bastante interessantes. Quando um navio chega com um novo tipo de robo; WALL  E acha que finalmente encontrou um amigo e fica no navio quando sai.
59,Rush Hour 3,2007,2010,Depois de uma tentativa de assassinato contra o embaixador Han; o inspetor Lee e o detetive Carter estao de volta a acao quando se dirigem a Paris para proteger uma mulher francesa com conhecimento dos lideres secretos das triades. Lee tambem realiza reunioes secretas com uma autoridade das Nacoes Unidas; mas suas lutas pessoais com um cerebro criminoso chines chamado Kenji; revelam que e o irmao ha muito perdido de Lee ....
60,2012,2009,2012,Dr. Adrian Helmsley; parte de uma equipe geofisica mundial que investiga o efeito sobre a Terra da radiacao de tempestades solares sem precedentes; descobre que o nucleo da Terra esta esquentando. Ele adverte o presidente dos Estados Unidos; Thomas Wilson; de que a crosta terrestre esta se tornando instavel e que; sem os devidos preparativos para salvar uma fracao da populacao mundial; toda a raca esta condenada. Enquanto isso; o escritor Jackson Curtis tropeca na mesma informacao. Enquanto os lideres mundiais tentam construir arcas para escapar do iminente cataclisma; Curtis luta para encontrar uma maneira de salvar sua familia. Enquanto isso; erupcoes vulcanicas e terremotos de forca sem precedentes causam estragos em todo o mundo.
61,A Christmas Carol,2009,2012,Miserante Ebenezer Scrooge e despertado na vespera de Natal por espiritos que revelam a ele sua propria existencia miseravel; que oportunidades ele desperdicou em sua juventude; suas crueldades atuais e o terrivel destino que o espera se ele nao mudar seus modos. Scrooge se depara com sua propria historia de crescente amargura e mesquinharia e deve decidir o que seu proprio futuro trara: a morte ou a redencao.
62,Jupiter Ascending,2015,2018,Em um universo onde o material genetico humano e o bem mais precioso; uma mulher jovem e pobre da Terra se torna a chave para manobras estrategicas e conflitos internos dentro de uma poderosa dinastia ...
63,The Legend of Tarzan,2016,2019,Tarzan; tendo se acostumado a vida em Londres; e chamado de volta a sua antiga casa na selva para investigar as atividades em um acampamento de mineracao.
64,The Chronicles of Narnia: The Lion; the Witch and the Wardrobe,2005,2008,Os irmaos Lucy; Edmund; Susan e Peter passam por um guarda-roupa magico e encontram a terra de Narnia. La; eles descobrem um reino encantador e outrora pacifico que foi mergulhado no inverno eterno pelo malvado Feiticeiro Branco; Jadis. Ajudado pelo sabio e magnifico leao; Aslan; as criancas levam Narnia a uma batalha espetacular e climax para se libertar dos poderes glaciais da Bruxa para sempre.
65,X-Men: Apocalypse,2016,2019,Apos o ressurgimento do primeiro Apocalypse mutante e destruidor do mundo; os X-Men devem se unir para derrotar seu plano de extincao.
66,The Dark Knight,2008,2011,Batman aumenta as apostas em sua guerra contra o crime. Com a ajuda do tenente Jim Gordon e do procurador Harvey Dent; Batman procura desmantelar as organizacoes criminosas que ainda estao nas ruas. A parceria prova ser eficaz; mas eles logo se encontram presos a um reinado de caos desencadeado por um criminoso crescente conhecido pelos cidadaos aterrorizados de Gotham como o Coringa.
67,Up,2009,2012,Carl Fredricksen passou toda a sua vida a sonhar em explorar o mundo e experimentar a vida ao maximo. Mas aos 78 anos; a vida parece ter passado por ele; ate que uma reviravolta do destino (e um persistente Explorador da Terra Selvagem de 8 anos chamado Russell) lhe da uma nova chance de vida.
